{
  "fecha": "2026-10-19",
  "titulo": "Boletín Carlota – lunes 19 de octubre de 2026",
  "ejemplo": false,
  "generado": "2026-10-19T07:20:00+02:00",
  "semaforo": {
    "nivel": "amarillo",
    "motivo": "Sin focos nuevos de lengua azul desde el jueves y ninguno en País Vasco ni Navarra, pero el virus circula en las dos, el Shamonda sigue en seis provincias y el 1 de noviembre cambian las normas de lengua azul."
  },
  "destacados": [
    "Pienso más caro: el maíz sube un 7 % en una semana en París (292,50 €/t) y la harina de soja llega a 462 €/t en Barcelona (+18 €).",
    "Unión de Uniones calcula que cierran 1,5 granjas de vacuno de leche al día. Pide reformar el paquete lácteo para negociar mejor con la industria y se moviliza el 28 de octubre.",
    "Lengua azul desde el 1 de noviembre: la vacunación será voluntaria en toda la península, aunque cada comunidad puede hacerla obligatoria. Cada dosis tendrá que comunicarse en 7 días."
  ],
  "margen": {
    "tendencia": "empeora",
    "texto": "Semana mala para el coste de la ración: el maíz europeo sube un 7 %, la harina de soja 18 €/t y el Brent se acerca a 110 $, mientras el precio de la leche no sube. El anticipo de la PAC (en Navarra, 74,2 M€) da algo de liquidez."
  },
  "precios": [
    { "producto": "Leche de vaca, Lonja de León (3,7 % grasa, 3,10 % proteína)", "valor": "sin actualización hoy", "variacion": "último dato: 0,475 €/l para oct–dic (+0,015)", "fecha": "14 oct 2026", "fuente": "Lonja de León", "url": "https://www.lonjadeleon.es/lonja-leche-de-vaca-14-10-2026/" },
    { "producto": "Leche de vaca en origen, España", "valor": "sin actualización hoy", "variacion": "último dato MAPA: 0,469 €/l (−9,7 % en un año)", "fecha": "agosto 2026", "fuente": "Agronews Castilla y León (datos MAPA)", "url": "https://www.agronewscastillayleon.com/produccion-leche-vaca-espana-agosto-2026-precio-ganaderos" },
    { "producto": "Leche desnatada en polvo (Países Bajos)", "valor": "sin actualización hoy", "variacion": "último dato: 359 €/100 kg (+17)", "fecha": "semana 42 (14 oct 2026)", "fuente": "Nieuwe Oogst (cotizaciones ZuivelNL)", "url": "https://www.nieuweoogst.nl/nieuws/2026/10/14/prijzen-boter-en-vollemelkpoeder-in-de-min-mageremelkpoeder-plust" },
    { "producto": "Mantequilla (Países Bajos)", "valor": "sin actualización hoy", "variacion": "último dato: 370 €/100 kg (−20)", "fecha": "semana 42 (14 oct 2026)", "fuente": "Nieuwe Oogst (cotizaciones ZuivelNL)", "url": "https://www.nieuweoogst.nl/nieuws/2026/10/14/prijzen-boter-en-vollemelkpoeder-in-de-min-mageremelkpoeder-plust" },
    { "producto": "Global Dairy Trade (índice)", "valor": "sin actualización hoy", "variacion": "última subasta: 3.928 USD/t, +1,2 % (6 oct); próxima subasta mañana, 20 oct", "fecha": "6 oct 2026", "fuente": "Farmers Weekly NZ / calendario GDT", "url": "https://www.globaldairytrade.info/en/gdt-events/calendar/" },
    { "producto": "Maíz, Euronext-París (noviembre)", "valor": "292,50 €/t", "variacion": "+19,25 €/t en la semana (+7,0 %); +58,97 % en un año", "fecha": "16 oct 2026", "fuente": "Agronews Castilla y León", "url": "https://www.agronewscastillayleon.com/precios-mundiales-cereales-maiz-trigo-colza-soja-octubre-2026" },
    { "producto": "Trigo, Euronext-París (diciembre)", "valor": "243,75 €/t", "variacion": "+1,75 €/t en la semana (+0,7 %)", "fecha": "16 oct 2026", "fuente": "Agronews Castilla y León", "url": "https://www.agronewscastillayleon.com/precios-mundiales-cereales-maiz-trigo-colza-soja-octubre-2026" },
    { "producto": "Maíz, Lonja de Binéfar", "valor": "256 €/t", "variacion": "sin cambios", "fecha": "14 oct 2026 (semana 42)", "fuente": "Cereales Arasanz (Lonja de Binéfar)", "url": "https://www.cerealesarasanz.com/noticias/semana-42-lonja-binefar-14-octubre-2026-en-un-mercado-con-poca-actividad-continua-la-tendencia-alcista-en-cebada-y-trigos/" },
    { "producto": "Cebada, Lonja de Binéfar", "valor": "244 €/t", "variacion": "+4 €/t", "fecha": "14 oct 2026 (semana 42)", "fuente": "Cereales Arasanz (Lonja de Binéfar)", "url": "https://www.cerealesarasanz.com/noticias/semana-42-lonja-binefar-14-octubre-2026-en-un-mercado-con-poca-actividad-continua-la-tendencia-alcista-en-cebada-y-trigos/" },
    { "producto": "Trigo pienso, Lonja de Binéfar", "valor": "261 €/t", "variacion": "+1 €/t", "fecha": "14 oct 2026 (semana 42)", "fuente": "Cereales Arasanz (Lonja de Binéfar)", "url": "https://www.cerealesarasanz.com/noticias/semana-42-lonja-binefar-14-octubre-2026-en-un-mercado-con-poca-actividad-continua-la-tendencia-alcista-en-cebada-y-trigos/" },
    { "producto": "Harina de soja 47 %, Barcelona", "valor": "462 €/t", "variacion": "+18 €/t (+4,05 %) desde el 6 oct (444)", "fecha": "13 oct 2026", "fuente": "3tres3", "url": "https://www.3tres3.com/precios-materias-primas/harina-soja-47-origen-espana-barcelona_1-soj" },
    { "producto": "Soja, Chicago (noviembre)", "valor": "416,00 €/t", "variacion": "−6,22 €/t en la semana (−1,5 %)", "fecha": "16 oct 2026", "fuente": "Agronews Castilla y León", "url": "https://www.agronewscastillayleon.com/precios-mundiales-cereales-maiz-trigo-colza-soja-octubre-2026" },
    { "producto": "Gasóleo B (agrícola), media ponderada España", "valor": "sin actualización hoy", "variacion": "último dato: 1,541 €/l (−1,13 %); Álava, cooperativas: 1,269 €/l", "fecha": "semana del 12 oct 2026", "fuente": "Infobae (EFE, informe semanal del MAPA)", "url": "https://www.infobae.com/espana/agencias/2026/10/14/el-gasoleo-b-baja-a-1541-euroslitro-pero-sigue-un-59-mas-caro-que-antes-de-la-guerra/" },
    { "producto": "Petróleo Brent (cierre)", "valor": "109,86 USD/barril", "variacion": "+3,94 USD (+3,7 %)", "fecha": "16 oct 2026", "fuente": "The Rio Times (Energy Now); EFE vía La Patilla", "url": "https://www.riotimesonline.com/oil-markets-latam-friday-october-16-2026/" },
    { "producto": "Euro/dólar", "valor": "≈1,12 USD", "variacion": "1,1216 en la sesión; mínimo de la semana 1,1151", "fecha": "16 oct 2026", "fuente": "Euribor.com.es", "url": "https://www.euribor.com.es/2026/10/16/analisis-de-mercados-16-de-octubre-de-2026-16-octubre-2026/" },
    { "producto": "Euríbor 12 meses (dato diario)", "valor": "3,215 %", "variacion": "−0,002; media provisional de octubre ≈3,216 %", "fecha": "publicado el 16 oct 2026", "fuente": "Euribor.com.es", "url": "https://www.euribor.com.es/2026/10/16/analisis-de-mercados-16-de-octubre-de-2026-16-octubre-2026/" }
  ],
  "secciones": [
    {
      "id": "sanidad",
      "titulo": "Sanidad animal",
      "items": [
        {
          "titular": "Lengua azul: desde el 1 de noviembre, vacunación voluntaria en toda la península",
          "ambito": "España",
          "resumen": "Actualización: la nueva orden del MAPA deja la península como «zona sin estatus»; vacunar será voluntario, aunque cada comunidad puede hacerlo obligatorio sin poner más trabas a los movimientos. No hay focos nuevos desde el jueves.",
          "detalle": "La orden que entra en vigor el 1 de noviembre (detallada por AgroCLM el 16 de octubre) sustituye a la de marzo de 2025. El cambio viene de la UE, que pasa la lengua azul a categoría D+E; se gestionará como la EHE.\n\nQué cambia: toda la península queda como «zona sin estatus»; la vacunación frente a los serotipos presentes en España es voluntaria y responsabilidad del titular a través de su veterinario. Las comunidades autónomas pueden hacerla obligatoria en su territorio, sin restricciones extra a los movimientos. No se permiten vacunas vivas atenuadas. Los animales sin signos clínicos podrán moverse dentro de la zona, para vida o sacrificio.\n\nRegistro: cada dosis se comunica en 7 días como máximo; en bovino se anota en el RIIA (tipo de vacuna, serotipo y fecha). La orden no habla de ayudas para la vacuna.\n\nSituación: según la actualización del 15 de octubre (ASAJA Castilla y León), los últimos focos son de Cádiz y Ourense (serotipo 8, vacuno) y Badajoz (serotipo 4, ovino); hay circulación confirmada en País Vasco y Navarra, entre otras zonas. Francia aplica el mismo cambio europeo el 1 de noviembre.\n\nQué puede significar: habrá que estar atentos a si el Gobierno Vasco o el de Navarra mantienen la vacunación obligatoria; con más libertad de movimiento, la vacunación de cada granja pesa más.",
          "soloLargo": false,
          "afectaMiZona": true,
          "fecha": "2026-10-16",
          "fuente": "AgroCLM (orden del MAPA) y ASAJA Castilla y León",
          "url": "https://www.agroclm.com/2026/10/16/el-gobierno-actualiza-las-medidas-frente-a-la-lengua-azul-vacunacion-voluntaria-en-la-peninsula/"
        },
        {
          "titular": "Gripe aviar: España prevé vacunar a veterinarios y personal de granjas en un año",
          "ambito": "España",
          "resumen": "Según una evaluación del ECDC, España empezará a vacunar frente a la gripe aviar H5 en el plazo de un año a veterinarios, trabajadores de explotaciones y otros colectivos expuestos, pero solo a quienes tengan más riesgo de enfermedad grave.",
          "detalle": "The Objective (13 de octubre) recoge el informe del Centro Europeo para la Prevención y el Control de Enfermedades (ECDC) del 7 de octubre. España vacunaría a veterinarios, personal de granjas, agentes medioambientales y trabajadores de zoológicos con factores de riesgo; otros países (Austria, Finlandia, Países Bajos, Portugal…) ya vacunan a todo el colectivo.\n\nEl ECDC considera el riesgo bajo para la población general y bajo-moderado para las personas expuestas. En la temporada 2025-2026 hubo 188 focos animales en España (16 en aves de corral, 165 en aves silvestres); el último, en mayo de 2026. No ha habido casos humanos.\n\nQué puede significar: de momento no afecta al vacuno de leche en Europa, pero conviene mantener la bioseguridad con aves silvestres en la granja.",
          "soloLargo": true,
          "fecha": "2026-10-13",
          "fuente": "The Objective (ECDC)",